{
  "specVersion": "1.0",
  "id": "fp_01J8Y5N3ZS6XWN8P4R1T9ZDYEF",
  "project": {
    "id": "df:project:01J8Y5N3ZR5WVM7N3Q0S8YCXDE",
    "name": "MyCoolApp",
    "description": "Example application",
    "url": "https://mycoolapp.example/",
    "repository": "https://github.com/sarah/mycoolapp",
    "version": "1.0.0"
  },
  "contributors": [
    {
      "identity": "https://sarah.example/.well-known/developer-footprint.json",
      "role": "creator"
    },
    {
      "identity": "https://john.example/.well-known/developer-footprint.json",
      "role": "owner"
    }
  ],
  "createdAt": "2026-09-24T00:00:00Z"
}
